<?xml version="1.0" encoding="UTF-8" standalone="no"?>
<!DOCTYPE biblioteca SYSTEM "Actividad2.dtd">
<biblioteca>
    <libros  id_l="L0001" genero_l= "novela" tipo_clase_l="1" numero_paginas_titulo="120">
        <titulo >Las aventuras de Pepe</titulo>

        <capitulos>
            <titulo_capitulo numero_paginas_capitulo="25">
                <nombre_capitulo>Viaje inesperado</nombre_capitulo>  
            </titulo_capitulo>
            <contenido_l enlace_l="enlace_Contenido.xml"></contenido_l>
            <titulo_capitulo numero_paginas_capitulo="25">
                <nombre_capitulo>Cuidado!</nombre_capitulo>   </titulo_capitulo>
                <contenido_l enlace_l="enlace_Contenido.xml"></contenido_l>
           
            <titulo_capitulo numero_paginas_capitulo="35">
                <nombre_capitulo>Este camino es mas fiable</nombre_capitulo>
            </titulo_capitulo>
                <contenido_l enlace_l="enlace_Contenido.xml"></contenido_l>
            
            <titulo_capitulo numero_paginas_capitulo="35">
                <nombre_capitulo>Lo hemos encontrado</nombre_capitulo> </titulo_capitulo>
                <contenido_l enlace_l="enlace_Contenido.xml"></contenido_l>
           
        </capitulos>

        <indice>
                 Viaje inesperado pag 1
                 Cuidado! pag 26
                 Este camino es mas fiable pag 51
                 Lo hemos encontrado pag 86   
        </indice>

        <sinopsis> Este libro cuenta los viajes de pepe en un tiempo inesperado para él </sinopsis>

    </libros>

    <revistas id_r="R0001" genero_r="coches" tipo_clase_r="2" numero_paginas_r="30">
        <titulo_r>Coches y motos</titulo_r>
        <numero_revista> 10 </numero_revista> 
        <indice_contenido>
            Ferrari pag 1
            BMW pag 11
            Honda pag 21
        </indice_contenido>
        <secciones_r numero_paginas_seccion="10">
            <nombre_seccion_r>Ferrari</nombre_seccion_r> 
            <contenido_r enlace_r="enlace_Contenido.xml" ></contenido_r>
        </secciones_r>
        <secciones_r numero_paginas_seccion="10">
            <nombre_seccion_r> BMW </nombre_seccion_r> 
            <contenido_r enlace_r="enlace_Contenido.xml" ></contenido_r>
        </secciones_r>
        <secciones_r numero_paginas_seccion="10"> 
            <nombre_seccion_r> Honda </nombre_seccion_r>
            <contenido_r enlace_r="enlace_Contenido.xml" ></contenido_r>
        </secciones_r>

    </revistas>

    <periodicos id_p="P0001" genero_p="nacionales" tipo_clase_p="1" fecha_publicacion_p="12-05-2021">
        <secciones_p genero_secciones_p="deportes">
            <articulos autor="Alejandro Dumas">Laporte jugara con la seleccion Española</articulos>
            <contenido_p enlace_p="enlace_Contenido.xml"></contenido_p>
        </secciones_p>
        <secciones_p genero_secciones_p="nacional">
            <articulos autor ="Federico Garcia">El fin del estado de alarma</articulos>
            <contenido_p enlace_p="enlace_Contenido.xml"></contenido_p>
        </secciones_p>
        <indice_p>
            Seccion deportes
            Seccion nacional
        </indice_p>


    </periodicos>

</biblioteca>